{"schema":"codegg.project-summary.v1","source_revision":"abc123","events":[{"id":"e1","occurred_at":"2026-10-16T09:00:00Z","kind":"file_changed","path":"docs/README.md","insertions":2,"deletions":0},{"id":"e2","occurred_at":"2026-10-16T10:00:00Z","kind":"file_changed","path":"src/a|b.rs","insertions":4,"deletions":1},{"id":"e3","occurred_at":"2026-10-16T10:30:00Z","kind":"test_failed"}],"totals":{"events":3,"files_changed":2,"insertions":6,"deletions":1},"by_kind":{"file_changed":2,"test_passed":0,"test_failed":1}}
